Phir Hera Pheri%(2006)%Babu Rao, Raju and Shyam, are living happily after having risen from rags to riches. Still, money brings the joy of riches and with it the greed to make more money - and so, with a don as an unknowing investor, Raju initiates a new game.%153 mins.%6.0%Comedy-Crime%Neeraj Vora%Neeraj Vora-Akshay Kumar-Sunil Shetty-Paresh Rawal
Jism 2%(2012)%Izna, a porn star, is given a task by IB Officer Ayaan Thakur to get hold of her ex-lover Kabir, who is now a gangster. But will Kabir accept Izna back into his life?%130 mins.%2.8%Drama-Romance-Thriller%Pooja Bhatt%Pooja Bhatt-Randeep Hooda-Sunny Leone-Arunoday Singh
Ashoka the Great%(2001)%The Epic tale of King Asoka's life.%176 mins.%6.7%Action-Drama-History-Romance-War%Santosh Sivan%Santosh Sivan-Shah Rukh Khan-Kareena Kapoor-Danny Denzongpa
Mumbai Diaries%(2010)%The lives of four people intersect in Mumbai: a washer-man who wants to become an actor, a banker-turned-photographer, a painter looking for inspiration, and a newly-married immigrant who journals her experiences on home video.%100 mins.%7.2%Drama%Kiran Rao%Kiran Rao-Prateik-Monica Dogra-Kriti Malhotra
Singham%(2011)%A humiliated gangster uses his influence and goon power to terrorize a newly transferred police officer.%143 mins.%6.7%Action-Crime-Drama%Rohit Shetty%Rohit Shetty-Ajay Devgn-Kajal Agarwal-Prakash Raj
New York%(2009)%A taxi-driver is detained on suspicion of being a terrorist.%153 mins.%6.7%Crime-Drama-Romance-Thriller%Kabir Khan%Kabir Khan-John Abraham-Neil Nitin Mukesh-Katrina Kaif
Shahid%(2012)%An account of slain Human Rights lawyer Shahid Azmi, an ordinary citizen with an extraordinary commitment to justice.%129 mins.%8.4%Biography-Crime-Drama-Thriller%Hansal Mehta%Hansal Mehta-Rajkummar Rao-Prabhleen Sandhu-Mohammed Zeeshan Ayyub
Salaam Bombay!%(1988)%The boy Krishna is abandoned by his mother at the Apollo Circus and she tells him that he can only return...%113 mins.%8.1%Crime-Drama%Mira Nair%Mira Nair-Shafiq Syed-Hansa Vithal-Chanda Sharma
Youngistaan%(2014)%Abhimanyu Kaul - a young, independent, Games Developer, living in Japan and the love of his life, Anwita Chauhan - a bubbly...%133 mins.%5.3%Drama%Syed Ahmed Afzal%Syed Ahmed Afzal-Jacky Bhagnani-Neha Sharma-Farooq Shaikh
Krrish%(2006)%The origins of the Indian superhero Krrish.%185 mins.%6.3%Action-Adventure-Romance-Sci-Fi%Rakesh Roshan%Rakesh Roshan-Rekha-Hrithik Roshan-Priyanka Chopra
City Lights%(2014)%Deepak Sing is a farmer in Rajasthan. After a tragedy, he migrates to Mumbai with his wife and child to lead a better life. However, upon arriving, he soon discovers the challenges of life in a big city.%126 mins.%7.2%Drama-Thriller%Hansal Mehta%Hansal Mehta-Rajkummar Rao-Mallhar Goenka-Manav Kaul
Shootout at Wadala%(2013)%The first-ever registered encounter by the Mumbai Police, which took place on November 1, 1982. Based on a true story.%155 mins.%5.8%Action-Crime%Sanjay Gupta%Sanjay Gupta-John Abraham-Kangana Ranaut-Anil Kapoor
Partner%(2007)%A 'Love Guru' assists other males, woos a widowed single mother, but becomes embroiled in controversies.%155 mins.%5.5%Comedy-Romance%David Dhawan%David Dhawan-Salman Khan-Govinda-Lara Dutta
Badmaa$h Company%(2010)%Four young friends get together in 90's middle class Mumbai to start a company, which turns out to be an instant hit due to their unorthodox methods.%142 mins.%6.0%Comedy-Crime-Drama%Parmeet Sethi%Parmeet Sethi-Shahid Kapoor-Anushka Sharma-Meiyang Chang
The Shaukeens%(2014)%Three friends in their 60s try to do everything that they couldn't do in their younger days - before death arrives.%124 mins.%5.5%Comedy%Abhishek Sharma%Abhishek Sharma-Akshay Kumar-Lisa Haydon-Rati Agnihotri
Mausam%(2011)%A war, religious conflicts, and misunderstandings create obstacles for a couple of different faiths.%161 mins.%4.6%Drama-Romance%Pankaj Kapur%Pankaj Kapur-Shahid Kapoor-Sonam Kapoor-Anupam Kher
Paa%(2009)%A father tries to help his son cope with a rare condition that causes the young boy to age beyond his years.%133 mins.%7.1%Comedy-Drama%R. Balki%R. Balki-Amitabh Bachchan-Abhishek Bachchan-Vidya Balan
Waqt: The Race Against Time%(2005)%Wagt the race against time is the story of a father and a son between whom there is a special bond....%153 mins.%6.8%Comedy-Drama-Musical-Romance%Vipul Amrutlal Shah%Vipul Amrutlal Shah-Amitabh Bachchan-Akshay Kumar-Priyanka Chopra
Break Ke Baad%(2010)%Childhood friends Abhay and Aaliya experience plenty of obstacles in their paths as they find their way in the world and back to each other.%118 mins.%5.0%Comedy-Drama-Romance%Danish Aslam%Danish Aslam-Deepika Padukone-Lillete Dubey-Imran Khan
Shanghai%(2012)%Prime leader of a campaign against a big government project is killed in what appears to be a road accident. An IAS officer is ordered to probe the incident and the veils of falsehood begin to drop.%120 mins.%7.3%Crime-Thriller%Dibakar Banerjee%Dibakar Banerjee-Emraan Hashmi-Abhay Deol-Prasenjit Chatterjee
Maine Pyar Kiya%(1989)%Kishen Kumar Chaudhary and Karan are family like friends, when Kishen's wife Mrs. Kaushalya gives birth to a baby boy Prem...%192 mins.%7.6%Family-Musical-Romance%Sooraj R. Barjatya%Sooraj R. Barjatya-Salman Khan-Bhagyashree-Alok Nath
Straight from the Heart%(1999)%A student of classical music and his teacher's daughter fall in love. However, the young woman's family arrange for her marriage to another man. The new groom surprises everyone with his actions in handling the situation.%188 mins.%7.6%Comedy-Drama-Musical-Romance%Sanjay Leela Bhansali%Sanjay Leela Bhansali-Salman Khan-Ajay Devgn-Aishwarya Rai Bachchan
It's Entertainment%(2014)%Akhil (Akshay Kumar) finds out that he is the heir of 3000 crore rupees as he and his mother were abandoned...%140 mins.%4.7%Comedy%Farhad%Farhad-Sajid-Akshay Kumar-Tamannaah Bhatia-Johnny Lever
Rocket Singh: Salesman of the Year%(2009)%Harpreet Singh Bedi (Ranbir Kapoor) has just graduated, and his marks are, well, let's say a little embarrassing...%150 mins.%7.5%Comedy-Drama%Shimit Amin%Shimit Amin-Ranbir Kapoor-Prem Chopra-Gauhar Khan
Lage Raho Munna Bhai%(2006)%Munna Bhai embarks on a journey with Mahatma Gandhi in order to fight against a corrupt property dealer.%144 mins.%8.2%Comedy-Drama-Romance%Rajkumar Hirani%Rajkumar Hirani-Sanjay Dutt-Arshad Warsi-Vidya Balan
Born to Hate... Destined to Love%(2012)%While fighting for the political supremacy of their respective families, a Hindu man and a Muslim woman share a forbidden romance.%120 mins.%6.6%Action-Drama-Romance%Habib Faisal%Habib Faisal-Arjun Kapoor-Parineeti Chopra-Gauhar Khan
Zinda%(2006)%A man, taken and locked up for 14 years without any sane reason, is suddenly released, and has 4 days to figure out why this was done to him.%116 mins.%4.9%Action-Adventure-Drama-Mystery-Thriller%Sanjay Gupta%Sanjay Gupta-Sanjay Dutt-John Abraham-Lara Dutta
Yuva%(2004)%Michael, Arjun and Lallan, three men from three different stratas of society, cross paths one morning in Calcutta and change one another's lives forever.%161 mins.%7.5%Action-Adventure-Crime-Drama%Mani Ratnam%Mani Ratnam-Ajay Devgn-Abhishek Bachchan-Rani Mukerji
I Am%(2010)%Four traumatic and life-changing stories in various parts of modern secular India.%95 mins.%6.9%Adventure-Drama-Romance%Onir%Onir-Juhi Chawla-Rahul Bose-Radhika Apte
Jal%(2013)%Jal is the story of young, willful BAKKA who is gifted with a special ability to find water in the desert...%126 mins.%6.6%Drama%Girish Malik%Girish Malik-Tannishtha Chatterjee-Saidah Jules-Purab Kohli
Hostel%(2011)%An Engineering student is molested, beaten and humiliated when he goes to reside in a hostel.%111 mins.%5.1%Action-Crime-Drama-Romance-Thriller%Manish Gupta%Manish Gupta-Vatsal Seth-Tulip Joshi-Mukesh Tiwari
Tere Naam%(2003)%Problems arise when Radhey Mohan, a delinquent falls in love with a girl named Nirjara.%132 mins.%7.1%Romance%Satish Kaushik%Satish Kaushik-Salman Khan-Bhoomika Chawla-Mahima Chaudhry
Filmistaan%(2012)%In Mumbai, affable Bollywood buff and wanna-be-actor Sunny, who works as an assistant director, fantasizes on becoming a heart-throb star...%117 mins.%7.3%Comedy%Nitin Kakkar%Nitin Kakkar-Sharib Hashmi-Inaamulhaq-Kumud Mishra
Guru%(2007)%A villager, Gurukant Desai, arrives in Bombay 1958, and rises from its streets to become the GURU, the biggest tycoon in Indian history.%166 mins.%7.8%Biography-Drama-Musical-Romance%Mani Ratnam%Mani Ratnam-Mithun Chakraborty-Abhishek Bachchan-Aishwarya Rai Bachchan
Once Upon a Time in Mumbai Dobaara!%(2013)%The story of Shoaib, an underworld don who came to power by killing his mentor and has extended his kingdom with the help of his best friend...%160 mins.%4.9%Action-Crime-Drama%Milan Luthria%Milan Luthria-Akshay Kumar-Sonakshi Sinha-Vidya Balan
Heroine%(2012)%A female superstar struggles through the trials and tribulations of being a Bollywood actress.%149 mins.%5.1%Drama%Madhur Bhandarkar%Madhur Bhandarkar-Kareena Kapoor-Arjun Rampal-Randeep Hooda
Aarakshan%(2011)%A decision by India's supreme court tests a man's friendships and loyalty.%164 mins.%6.2%Drama-Thriller%Prakash Jha%Prakash Jha-Amitabh Bachchan-Saif Ali Khan-Manoj Bajpayee
Sarkar Raj%(2008)%When Anita Rajan, CEO of Sheppard power plant, an international Company, brings a power plant proposal...%125 mins.%6.8%Action-Crime-Drama-Thriller%Ram Gopal Varma%Ram Gopal Varma-Amitabh Bachchan-Abhishek Bachchan-Aishwarya Rai Bachchan
Darr%(1993)%A woman is caught between one man's love and another man's obsession. She fears one and fears for the other. One stands for love and the other for life. Who will she choose?%178 mins.%8.1%Drama-Mystery-Romance-Thriller%Yash Chopra%Yash Chopra-Sunny Deol-Juhi Chawla-Shah Rukh Khan
Sonali Cable%(2014)%Sonali, a spunky self-made internet operator, proudly runs a small outfit along with her band of ghetto boys catering to a sprawling Mumbai suburb...%127 mins.%5.8%Drama%Charudutt Acharya%Charudutt Acharya-Rhea Chakraborty-Ali Fazal-Smita Jaykar
Ajnabee%(2001)%Bobby Deol and Kareena Kapoor play a new couple who get married and move to Switzerland. They make friends with their new neighbours Akshay Kumar and Bipasha Basu. Life seems perfect until one day when Bobby Deol wakes up in Akshay's house and finds out that Akshay's wife has been murdered. Bobby Deol is accussed of the murder but flees from the authorities in order to prove himself innocent.%165 mins.%6.3%Crime-Mystery-Thriller%Abbas Alibhai Burmawalla%Abbas Alibhai Burmawalla-Mastan Alibhai Burmawalla-Akshay Kumar-Bobby Deol-Kareena Kapoor
Bewakoofiyaan%(2014)%Mohit and Mayera, a young corporate couple in love, run into trouble when Mayera's overprotective father thinks Mohit isn't good enough for her.%119 mins.%5.4%Comedy-Drama-Romance%Nupur Asthana%Nupur Asthana-Ayushmann Khurrana-Sonam Kapoor-Rishi Kapoor
Hum Aapke Hain Koun...!%(1994)%It tells the story of two lovers, Prem (Salman Khan) and Nisha (Madhuri Dixit). Their older siblings...%206 mins.%7.6%Comedy-Drama-Musical-Romance%Sooraj R. Barjatya%Sooraj R. Barjatya-Madhuri Dixit-Salman Khan-Mohnish Bahl
Ghanchakkar%(2013)%A safe cracker claims he has lost his memory when two criminals come calling for their cut of the bank heist loot.%137 mins.%5.7%Comedy-Crime-Thriller%Raj Kumar Gupta%Raj Kumar Gupta-Emraan Hashmi-Vidya Balan-Parvin Dabas
Housefull 2%(2012)%Four son-in-laws marry four brides whose four father-in laws mistake every son-in law for Jolly.%145 mins.%5.1%Comedy-Romance%Sajid Khan%Sajid Khan-Akshay Kumar-Asin-John Abraham
Chup Chup Ke%(2006)%A debt-ridden young man attempts suicide, but is rescued only to find that his luck is finally turning.%164 mins.%6.5%Comedy-Drama-Romance%Priyadarshan%Priyadarshan-Kookie V. Gulati-Shahid Kapoor-Kareena Kapoor-Om Puri
Tashan%(2008)%A woman runs off with her gangster boss's money, and he hires her betrayed ex-lover and a bounty hunter to bring her back.%120 mins.%3.8%Action-Comedy-Crime-Drama-Romance%Vijay Krishna Acharya%Vijay Krishna Acharya-Akshay Kumar-Saif Ali Khan-Kareena Kapoor
Jaane Tu... Ya Jaane Na%(2008)%Two best friends being convinced that they are not in love search for each other's love.%155 mins.%7.6%Comedy-Drama-Romance%Abbas Tyrewala%Abbas Tyrewala-Imran Khan-Genelia D'Souza-Manjari Phadnis
Once Upon a Time in Mumbai%(2010)%A smuggler rises to power in in 1970s Mumbai, a younger gangster seeks to overthrow him, and a police officer is caught in the middle.%134 mins.%7.4%Crime-Drama-Romance%Milan Luthria%Milan Luthria-Kangana Ranaut-Emraan Hashmi-Randeep Hooda
Earth%(1998)%It's 1947 and the borderlines between India and Pakistan are being drawn. A young girl bears witnesses to tragedy as her ayah is caught between the love of two men and the rising tide of political and religious violence.%110 mins.%7.8%Drama-Romance-War%Deepa Mehta%Deepa Mehta-Aamir Khan-Nandita Das-Rahul Khanna
Main Aurr Mrs Khanna%(2009)%An unhappily married couple find love in strange situations.%109 mins.%3.6%Comedy-Drama%Prem Soni%Prem Soni-Kareena Kapoor-Salman Khan-Sohail Khan
Yaariyan%(2014)%A college student must win an inter college competition to save his college from being demolished by property builders.%145 mins.%2.8%Drama-Romance%Divya Khosla%Divya Khosla-Himansh Kohli-Vivek Bhatnagar-Nicole Faria
R... Rajkumar%(2013)%An aimless youth starts working for drug baron and his mission is to kill is rival.%146 mins.%5.1%Action-Comedy-Romance%Prabhudheva%Prabhudheva-Shahid Kapoor-Sonakshi Sinha-Sonu Sood
Singham Returns%(2014)%Owing to the wrongdoings affiliated with evils similar to black money, an honest but ferocious police officer returns as the Deputy Commissioner of Police with the prospect of wiping out injustice.%142 mins.%5.8%Action-Drama%Rohit Shetty%Rohit Shetty-Kareena Kapoor-Ajay Devgn-Anupam Kher
Mr India%(1987)%A poor but big-hearted man takes orphans into his home. After discovering his scientist father's invisibility device, he rises to the occasion and fights to save his children and all of India from the clutches of a megalomaniac.%179 mins.%7.9%Action-Adventure-Comedy-Drama-Fantasy-Musical-Romance-Sci-Fi%Shekhar Kapur%Shekhar Kapur-Anil Kapoor-Sridevi-Amrish Puri
Chocolate: Deep Dark Secrets%(2005)%Christmas Eve, London. While the snow-clad city gets ready to celebrate the festival of peace and joy...%160 mins.%4.7%Thriller%Vivek Agnihotri%Vivek Agnihotri-Anil Kapoor-Sunil Shetty-Arshad Warsi
Satyagraha%(2013)%A corporate go-getter sees his priorities shift when a personal tragedy brings him face-to-face with political corruption.%152 mins.%6.0%Drama%Prakash Jha%Prakash Jha-Kareena Kapoor-Amitabh Bachchan-Ajay Devgn
Welcome%(2007)%A man falls in love with a beautiful woman, but later discovers that her brothers are gangsters.%159 mins.%6.3%Comedy-Crime-Drama%Anees Bazmee%Anees Bazmee-Akshay Kumar-Nana Patekar-Anil Kapoor
Bhool Bhulaiyaa%(2007)%When U.S.-based Siddharth visits his Indian home town with his new wife, he insists they stay at the ancestral home...%159 mins.%7.0%Comedy-Horror-Mystery-Thriller%Priyadarshan%Priyadarshan-Akshay Kumar-Vidya Balan-Ameesha Patel
Raaz 3: The Third Dimension%(2012)%When an ingnue's sudden popularity threatens to shove her out of the spotlight, a movie star uses black magic in an attempt to derail her career.%139 mins.%3.9%Horror-Romance-Thriller%Vikram Bhatt%Vikram Bhatt-Emraan Hashmi-Bipasha Basu-Esha Gupta
Sangharsh%(1999)%CBI officer Reet Oberoi sought assistance from a jail convict Professor Aman Varma to bring Lajja Shankar Pandey; a religious fanatic to justice...%127 mins.%6.6%Action-Crime-Thriller%Tanuja Chandra%Tanuja Chandra-Akshay Kumar-Preity Zinta-Ashutosh Rana
De Dana Dan%(2009)%Singapore-based Nitin Bankar's education was paid for by his employer, Kuljeet Kaur, and he, after the passing of his father...%162 mins.%4.9%Comedy%Priyadarshan%Priyadarshan-Akshay Kumar-Sunil Shetty-Katrina Kaif
Fashion%(2008)%A small-town girl finally realizes her dream of becoming a famous supermodel but soon finds out that there's a price for her glamorous new life.%167 mins.%6.9%Drama-Romance%Madhur Bhandarkar%Madhur Bhandarkar-Priyanka Chopra-Kangana Ranaut-Mugdha Godse
The Rising: Ballad of Mangal Pandey%(2005)%Based on the life and times of Mangal Pandey, 1857: The Rising is a film about the leader of the 1857 mutiny and his fight against the British rule.%150 mins.%6.7%Biography-Drama-History-War%Ketan Mehta%Ketan Mehta-Aamir Khan-Rani Mukerji-Toby Stephens
Murder 3%(2013)%A hot-shot fashion and wildlife photographer Vikram gets into a relationship with Nisha. She moves in...%124 mins.%4.8%Thriller%Vishesh Bhatt%Vishesh Bhatt-Randeep Hooda-Aditi Rao Hydari-Sara Loren
Manjunath%(2014)%The life of Shanmugam Manjunath who was an IIM student.%130 mins.%7.3%Biography-Drama%Sandeep A. Varma%Sandeep A. Varma-Anjori Alagh-Karan Ashar-Asif Basra
Baabul%(2006)%Babul tells the tale of a man (Bachchan) who tries to bring happiness back into his daughter-in-law (Mukherjee)'s life after his son (Salman)'s death.%169 mins.%5.3%Drama-Family-Romance%Ravi Chopra%Ravi Chopra-Amitabh Bachchan-Salman Khan-Hema Malini
Murder 2%(2011)%A former police officer gets hired by a gangster to trace missing call girls and their abductor.%127 mins.%6.0%Action-Crime-Drama-Thriller%Mohit Suri%Mohit Suri-Jacqueline Fernandez-Yana Gupta-Emraan Hashmi
Murder%(2004)%Living in Bangkok with her husband Sudhir and the child from his first marriage to her sister, Simran...%130 mins.%5.3%Drama-Thriller%Anurag Basu%Anurag Basu-Mallika Sherawat-Ashmit Patel-Emraan Hashmi
Total Chaos%(2014)%A young musician hopes to marry his beautiful Indian girlfriend, but his plans hit a snag when her family learns he's Pakistani.%108 mins.%5.1%Comedy-Drama-Romance%Eeshwar Nivas%Eeshwar Nivas-Ali Zafar-Yami Gautam-Anupam Kher
The Stoneman Murders%(2009)%In 1980s Bombay, a serial killer starts targeting homeless street dwellers, whilst a suspended police officer attempts to solve the case.%95 mins.%7.4%Crime-Drama-Mystery-Thriller%Manish Gupta%Manish Gupta-Kay Kay Menon-Arbaaz Khan-Rukhsar
Salaam-E-Ishq%(2007)%Six couples in love must face different problems caused by love itself. Do they resolve their issues and face life anew, or do they succumb under pressure ?%216 mins.%5.1%Comedy-Drama-Musical-Romance%Nikhil Advani%Nikhil Advani-Salman Khan-Priyanka Chopra-Anil Kapoor
Jigyaasa%(2006)%Story of an innocent girl who comes from a very poor family. She has dreams to become a super-star at any given cost. But little she knew was how bad she'll be exploited in the dark side of film world!%147 mins.%5.2%Drama%Faisal Saif%Faisal Saif-Nassar Abdulla-Rakesh Bedi-Hrishitaa Bhatt
Kaho Naa... Pyaar Hai%(2000)%Rich girl loves poor singer and vice versa. But fate has two surprises in store.%172 mins.%6.8%Action-Crime-Romance%Rakesh Roshan%Rakesh Roshan-Hrithik Roshan-Ameesha Patel-Anupam Kher
Heyy Babyy%(2007)%Aarush, Ali and Tanmay wake up to find a baby left outside their door.%144 mins.%5.7%Comedy-Drama%Sajid Khan%Sajid Khan-Akshay Kumar-Vidya Balan-Fardeen Khan
Bullett Raja%(2013)%A common man who transforms into a gangster revolts against the very system he once obediently followed by declaring war on the police, the government, and the industrialists.%138 mins.%5.1%Action-Crime-Drama%Tigmanshu Dhulia%Tigmanshu Dhulia-Saif Ali Khan-Sonakshi Sinha-Vidyut Jamwal
Horror Story%(2013)%Seven youngsters decide to spend a night in an abandoned haunted hotel. What they mistook as merely rumors, dawns on them to be the truth as they realize they are not alone inside.%91 mins.%5.3%Horror%Ayush Raina%Ayush Raina-Aparna Bajpai-Ravish Desai-Karan Kundra
Mahabharat%(2013)%Mahabharat is considered as the greatest and the longest epic in world literature It has all the possible elements that a story could have - conflict...%105 mins.%5.3%Animation-Action%Amaan Khan%Amaan Khan-Amitabh Bachchan-Ajay Devgn-Vidya Balan
Dor%(2006)%Two woman --different backgrounds, miles apart, and strangers to each other-- are linked by tragedy. Their new-found friendship is tested as one holds the fate of the other's husband in her hands.%147 mins.%8.0%Drama%Nagesh Kukunoor%Nagesh Kukunoor-Ayesha Takia-Shreyas Talpade-Gul Panag
Manorama Six Feet Under%(2007)%Rajasthan-based Satyaveer Singh Randhawa works as a Junior Engineer with Lahkot Municipality's Public...%137 mins.%7.9%Crime-Drama-Mystery-Thriller%Navdeep Singh%Navdeep Singh-Abhay Deol-Gul Panag-Raima Sen
I Am Kalam%(2010)%An impoverished boy forms an unlikely and unstable friendship with the lonely son of a nobleman.%88 mins.%7.9%Comedy-Drama%Nila Madhab Panda%Nila Madhab Panda-Gulshan Grover-Harsh Mayar-Hussan Saad
Shool%(1999)%Police Inspector Samar Pratap Singh is transferred to Motihari, in the Indian state of Bihar, along with his wife...%138 mins.%7.6%Action-Crime-Drama-Thriller%Eeshwar Nivas%Eeshwar Nivas-Manoj Bajpayee-Raveena Tandon-Sayaji Shinde
Awaara%(1951)%Raju lives as a derelict as a result of being estranged from his bitter father, a district judge, who threw Raju's mother out of the house years ago...%193 mins.%8.1%Drama-Musical-Romance%Raj Kapoor%Raj Kapoor-Prithviraj Kapoor-Nargis-Raj Kapoor
Gunga Jumna%(1961)%Widowed Govindi lives a poor lifestyle in Haripur along with two sons, Gungaram and Jumna. While Jumna is studious...%178 mins.%7.3%Drama-Action-Crime-Musical%Nitin Bose%Nitin Bose-Dilip Kumar-Vyjayanthimala-Nasir Khan
Listen... Amaya%(2013)%(Hindi with English subtitles) In this poignant Bollywood-styled indie interpretation about family ties and growing up...%108 mins.%6.9%Drama%Avinash Kumar Singh%Avinash Kumar Singh-Farooq Shaikh-Deepti Naval-Swara Bhaskar
Coolie No. 1%(1995)%In order to avenge his insult against wealthy Hoshiarchand Choudhary; Pandit Shaadiram Gharjodhe asks...%143 mins.%6.1%Comedy%David Dhawan%David Dhawan-Govinda-Karisma Kapoor-Harish
Saudagar%(1973)%Moti sells gurd in the market. He collects the raw material and takes them to an older woman, Mahjubhi...%131 mins.%7.2%Drama-Family%Sudhendu Roy%Sudhendu Roy-Amitabh Bachchan-Nutan-Trilok Kapoor
Sins%(2005)%A Catholic priest becomes romantically involved with a young woman.%138 mins.%4.1%Drama-Romance%Vinod Pande%Vinod Pande-Vinod Pande-Shiney Ahuja-Seema Rahmani
Bawarchi%(1972)%Squabbling Sharma family has a dubious reputation of not having any cook last there for more than a few months...%130 mins.%7.9%Comedy-Musical-Drama-Family%Hrishikesh Mukherjee%Hrishikesh Mukherjee-Rajesh Khanna-Jaya Bhaduri-Usha Kiran
Mujhse Dosti Karoge!%(2002)%Raj, Pooja and Tina are childhood friends. While Raj has always been attracted to the vivacious Tina...%149 mins.%5.0%Musical-Romance-Drama-Family%Kunal Kohli%Kunal Kohli-Rani Mukerji-Hrithik Roshan-Kareena Kapoor
Gulaal%(2009)%A law student witnesses the struggles of the Rajputs, deception, homicide, and crime after being elected as General Secretary of his college.%140 mins.%8.1%Crime-Drama-Thriller%Anurag Kashyap%Anurag Kashyap-Kay Kay Menon-Raj Singh Chaudhary-Jesse Randhawa
The Cup%(1999)%While the soccer World Cup is being played in France, two young Tibetan refugees arrive at a monastery/boarding school in exile in India...%93 mins.%6.9%Comedy-Sport%Khyentse Norbu%Khyentse Norbu-Orgyen Tobgyal-Neten Chokling-Jamyang Lodro
Hum Hain Rahi Pyar Ke%(1993)%Rahul Malhotra (Aamir Khan) is the manager of the heavily in debt family business. He is also the guardian of his dead sister's mischievous kids...%163 mins.%7.5%Drama-Family-Comedy-Romance%Mahesh Bhatt%Mahesh Bhatt-Aamir Khan-Juhi Chawla-Sharokh Bharucha
Fiza%(2000)%In 1993 Fiza's brother disappears during the riots in Mumbai. In 1999 Fiza is tired of waiting and goes looking for him.%170 mins.%6.3%Drama-Romance%Khalid Mohamed%Khalid Mohamed-Jaya Bhaduri-Karisma Kapoor-Hrithik Roshan
Woh 7 Din%(1983)%Maya, coming from poor family, is married to the affluent Dr. Anand; but she tries to commit suicide on the nuptial night...%139 mins.%7.6%Comedy-Drama-Family%Bapu%Bapu-Anil Kapoor-Padmini Kolhapure-Naseeruddin Shah
Three Walls%(2003)%The story of a documentary movie-maker who films the reformation story of three hardened criminals within the prison walls - and in the process, finds redemption in her own life.%115 mins.%7.9%Crime-Drama%Nagesh Kukunoor%Nagesh Kukunoor-Naseeruddin Shah-Jackie Shroff-Juhi Chawla
Raincoat%(2004)%All he wanted was to see her just once. Manu was from a village in the backwoods. Neeru was the girl next door, his lost love.%117 mins.%7.5%Drama-Romance%Rituparno Ghosh%Rituparno Ghosh-Ajay Devgn-Aishwarya Rai Bachchan-Annu Kapoor
Naina%(2005)%After receiving an eye transplant, a young woman realizes that she can see into the supernatural world.%104 mins.%4.4%Drama-Horror-Mystery-Thriller%Shripal Morakhia%Shripal Morakhia-Urmila Matondkar-Anuj Sawhney-Malavikka
Hum%(1991)%A wealthy and cruel businessman, Bhaktawar lord over a dockyard making all the workers his slaves. All...%184 mins.%6.9%Action-Crime-Drama-Family%Mukul Anand%Mukul Anand-Amitabh Bachchan-Rajinikanth-Govinda
Seeta Aur Geeta%(1972)%Long-suffering heiress Seeta is treated worse than a servant by her abusive money-grubbing aunt. Meanwhile, her long-lost twin sister Geeta grows up to be a gutsy street-performer. One day, the girls unintentionally swap places.%162 mins.%6.9%Adventure-Comedy-Romance-Drama-Family-Musical%Ramesh Sippy%Ramesh Sippy-Dharmendra-Sanjeev Kumar-Hema Malini
Hum Kisise Kum Naheen%(1977)%A businessman, an underachever, an heiress, her mobster father, his gang, his assistant and his father...%169 mins.%7.2%Adventure-Romance-Action-Comedy-Drama-Musical%Nasir Hussain%Nasir Hussain-Rishi Kapoor-Tariq-Kaajal Kiran
London Paris New York%(2012)%Nikhil and Lalitha are two completely different individuals who are drawn to each other in spite of their differences -- or perhaps because of it. Follow their journey as they meet in London, Paris and New York for a night in each city.%100 mins.%5.7%Romance%Anu Menon%Anu Menon-Ali Zafar-Aditi Rao Hydari-Candice Pereira
