Hamara Dil Aapke Paas Hai%(2000)%Inspired by the Telugu film, "Pelli Chuskundam," the plot follows the life of a rape victim (Aishwarya Rai)...%165 mins.%5.6%Family-Comedy-Drama-Romance%Satish Kaushik%Satish Kaushik-Anil Kapoor-Aishwarya Rai Bachchan-Sonali Bendre
Coffee Bloom%(2015)%Dev, though a self proclaimed wise man, finds comfort in being a loser, having given up on life as a result of a love gone wrong. A life changing event takes him on a journey to a coffee plantation.%90 mins.%7.6%Drama%Manu Warrier%Manu Warrier-Arjun Mathur-Mohan Kapoor-Sugandha Garg
Ziddi%(1997)%Omnipresent Bollywood acting dynamo Sunny Deol stars as Deva, the son of an honest lawyer (Anupam Kher) who lives with his brother...%170 mins.%5.6%Action-Drama%Guddu Dhanoa%Guddu Dhanoa-Sunny Deol-Raveena Tandon-Anupam Kher
8 x 10 Tasveer%(2009)%A man with the ability to visit the past by looking at photographs, must solve the mystery behind his father's sudden death.%122 mins.%5.3%Crime-Drama-Mystery-Sci-Fi-Thriller%Nagesh Kukunoor%Nagesh Kukunoor-Akshay Kumar-Ayesha Takia-Javed Jaffrey
Roti Kapada Aur Makaan%(1974)%After the retirement of his dad, the onus is on Bharat to look after the Delhi-based family. He has two younger college-going brothers...%159 mins.%7.0%Drama-Musical%Manoj Kumar%Manoj Kumar-Manoj Kumar-Shashi Kapoor-Zeenat Aman
Company%(2002)%A slumdog named Chandu teams up with Malik, a low-level enforcer for a criminal syndicate. Together they eliminate all their enemies, becoming the most feared gangsters in Mumbai before jealousy and anger turn them against each other.%155 mins.%8.1%Action-Crime-Thriller-Drama%Ram Gopal Varma%Ram Gopal Varma-Ajay Devgn-Mohanlal-Manisha Koirala
Coolie%(1983)%A wealthy, but evil man named Zafar Khan, has fallen in love a girl named Salma and wants to marry her...%177 mins.%6.7%Drama-Action-Comedy-Romance-Family%Manmohan Desai%Manmohan Desai-Prayag Raj-Amitabh Bachchan-Waheeda Rehman-Rishi Kapoor
Chalo Dilli%(2011)%Enroute to her destination via plane, a busy executive gets stranded with a middle-classed fast-talking male.%155 mins.%6.7%Comedy-Drama%Shashant Shah%Shashant Shah-Vinay Pathak-Lara Dutta-Yana Gupta
Yaarana%(1981)%Multi-millionaire Bishan Kumar and orphan Kishan are inseparable friends and live in the same house with Bishan's widowed mother and a maid servant...%138 mins.%7.1%Drama-Musical-Romance-Action%Rakesh Kumar%Rakesh Kumar-Amitabh Bachchan-Neetu Singh-Tanuja
Kyaa Kool Hai Hum%(2005)%Karan Pandey and Rahul are two friends who work in a fashion designers office, and live in a rented apartment...%172 mins.%6.3%Comedy-Mystery%Sangeeth Sivan%Sangeeth Sivan-Tusshar Kapoor-Riteish Deshmukh-Isha Koppikar
36 China Town%(2006)%An inspector heads to Chinatown, a resort, to investigate the occurrence of a crime, only to discover that in Chinatown, EVERYBODY is a criminal...%140 mins.%5.5%Comedy-Mystery-Thriller%Abbas Alibhai Burmawalla%Abbas Alibhai Burmawalla-Mastan Alibhai Burmawalla-Akshaye Khanna-Kareena Kapoor-Shahid Kapoor
Bluffmaster!%(2005)%A conman Roy, gets dumped by his girl-friend. Then he finds out he has a fatal disease. On the verge of death, he resolves to do some good, by helping his apprentice Dittu hoodwink the mobster who hurt his (Dittu's) family.%137 mins.%6.8%Comedy-Romance-Thriller%Rohan Sippy%Rohan Sippy-Abhishek Bachchan-Priyanka Chopra-Riteish Deshmukh
Satya%(1998)%A young man named Satya (J.D Chakravarthy) comes to Mumbai from South India in search of a job. Jailed for something he did not do...%170 mins.%8.2%Action-Crime-Drama-Thriller%Ram Gopal Varma%Ram Gopal Varma-J.D. Chakravarthi-Urmila Matondkar-Paresh Rawal
Sixteen%(2013)%Welcome to sixteen's world. A world where growing up has speeded up multifold times from the time you and me were kids...%138 mins.%6.3%Drama-Romance-Thriller%Raj Purohit%Raj Purohit-Wamiqa Gabbi-Izabelle Leite-Mehak Manwani
Creature%(2014)%A newly-opened forest lodge finds itself under attack from a recently awakened creature.%134 mins.%3.1%Horror-Sci-Fi%Vikram Bhatt%Vikram Bhatt-Bipasha Basu-Imran Abbas-Mukul Dev
Khamosh%(1985)%Thriller about mysterious murders that take place on a film location. Which of the crew is guilty? Or is it someone from outside...%101 mins.%7.3%Mystery-Thriller%Vidhu Vinod Chopra%Vidhu Vinod Chopra-Shabana Azmi-Amol Palekar-Sudhir Mishra
Tere Bin Laden%(2010)%A Pakistani news reporter concocts a novel video in a desperate bid to immigrate to the United States of America.%95 mins.%7.3%Comedy-Drama%Abhishek Sharma%Abhishek Sharma-Ali Zafar-Pradhuman Singh-Piyush Mishra
Zeher%(2005)%Police Inspector Sonia Mehra is married to her subordinate Siddharth, and both are employed by the Goa Police Force...%132 mins.%5.4%Thriller%Mohit Suri%Mohit Suri-Emraan Hashmi-Shamita Shetty-Udita Goswami
Issaq%(2013)%A contemporary adaptation of Romeo and Juliet set in the backdrop of Varanasi in the UP heartland, complete with naxalism, sand mining mafia and of course the timeless love story.%148 mins.%4.4%Drama%Manish Tiwary%Manish Tiwary-Malini Awasthi-Sandeep Bose-Amyra Dastur
Tahkhana%(1986)%A dying Thakur Surjeet Singh bequeaths the entire estate to his son, Raghuvir, disowning the other, Dhurjan...%117 mins.%5.7%Action-Drama-Horror%Shyam Ramsay%Shyam Ramsay-Tulsi Ramsay-Rana Jung Bahadur-Hemant Birje-Deepak
Good Boy  Bad Boy%(2007)%Two college students exchange their classes after the college management mixed their identical names by mistake.%115 mins.%3.4%Comedy-Musical-Romance%Ashwini Chaudhary%Ashwini Chaudhary-Tusshar Kapoor-Emraan Hashmi-Isha Sharvani
99%(2009)%A gangster deputes two of his men to recover money from an out of town compulsive gambler.%135 mins.%7.3%Comedy-Crime-Drama%Krishna D.K.%Krishna D.K.-Raj Nidimoru-Kunal Khemu-Boman Irani-Soha Ali Khan
Baazigar%(1993)%A vengeful young man marries the daughter of a corrupt industrialist in order to seek justice for his father's suicide.%175 mins.%7.9%Crime-Drama-Thriller%Abbas Alibhai Burmawalla%Abbas Alibhai Burmawalla-Mastan Alibhai Burmawalla-Shah Rukh Khan-Rakhee Gulzar-Kajol
Karan Arjun%(1995)%Karan and Arjun reincarnate in the different parts of the country. But the faith of their previous mother brings them together in order to avenge their death.%175 mins.%6.9%Action-Comedy-Fantasy-Romance%Rakesh Roshan%Rakesh Roshan-Rakhee Gulzar-Salman Khan-Shah Rukh Khan
Chitkabrey%(2011)%A group of former collegians are confined by a victim they had ragged 15 years ago.%120 mins.%4.2%Drama-Mystery-Thriller%Suneet Arora%Suneet Arora-Ravi Kishan-Rahul Singh-Rajesh Shringarpore
Fida%(2004)%Fida tells the story of Jai who one day happen to meet a young and beautiful woman called Neha and he falls in love with her at first sight...%122 mins.%5.5%Romance-Thriller%Ken Ghosh%Ken Ghosh-Kareena Kapoor-Fardeen Khan-Shahid Kapoor
Malamaal Weekly%(2006)%Lilaram sells lottery tickets and one customer has hit the jackpot but dies of shock upon finding out that he has won. Now, Lilaram wants all the money, and so does everyone around him.%137 mins.%6.7%Comedy-Drama-Romance%Priyadarshan%Priyadarshan-Paresh Rawal-Om Puri-Riteish Deshmukh
MSG: The Messenger%(2015)%Guru Ji is a social reformer who works to help people fight against social evils.%197 mins.%6.5%Action-Comedy-Drama-Fantasy%Jeetu Arora%Jeetu Arora-Gurmeet Ram Rahim Singh Ji Insan-Gurmeet Ram Rahim Singh Ji Insan-Daniel Kaleb-Fllora Saini
Gang of Ghosts%(2014)%A story about a group of ghosts who have lost their shelter due to urbanization. The story starts with...%128 mins.%3.8%Comedy-Drama%Satish Kaushik%Satish Kaushik-Sharman Joshi-Mahie Gill-Asrani
Dhol%(2007)%Sameer Arya, Martand Damdere, Pankaj Tiwari, and Gautam Sesodia are friends who live in a small town in India...%145 mins.%5.8%Comedy-Crime-Thriller%Priyadarshan%Priyadarshan-Sharman Joshi-Tusshar Kapoor-Kunal Khemu
Heer Ranjha%(1992)%A newer version of the popular love story of Heer (Sridevi) and Deedho (Anil Kapoor), who calls himself Ranjha...%159 mins.%6.7%Drama-Romance%Harmesh Malhotra%Harmesh Malhotra-Anil Kapoor-Sridevi-Anupam Kher
Baadshah%(1999)%In order to settle personal scores with the Chief Minister Gayetri Bachchan; a wealthy business-man...%175 mins.%6.9%Action-Comedy-Musical-Thriller%Abbas Alibhai Burmawalla%Abbas Alibhai Burmawalla-Mastan Alibhai Burmawalla-Rakhee Gulzar-Shah Rukh Khan-Twinkle Khanna
Haasil%(2003)%Anirudhh, a law-abiding college student, in love with Niharika, gets caught up in college politics and crime, and must fight it out for himself, when friends turn into foes.%160 mins.%7.6%Crime-Drama-Romance%Tigmanshu Dhulia%Tigmanshu Dhulia-Jimmy Shergill-Hrishitaa Bhatt-Irrfan Khan
Players%(2012)%Two thieves, a magician, a computer hacker, a wannabe actor and a explosives expert plan a robbery to fulfill the dream of Victor Braganza. Will they be successful or will destiny have something different for them?%163 mins.%4.0%Action-Crime-Thriller%Abbas Alibhai Burmawalla%Abbas Alibhai Burmawalla-Mastan Alibhai Burmawalla-Luna Rioumina-Abhishek Bachchan-Bipasha Basu
Naya Daur%(1957)%Shankar lives in a remote village in rural India with his mother and sister, Manju, and drives a horse-carriage for a living...%173 mins.%8.1%Musical-Drama-Family%B.R. Chopra%B.R. Chopra-Dilip Kumar-Vyjayanthimala-Ajit
The Dirty Picture%(2011)%The love story between an actress and a director. Inspired by the life of the late south Indian actress Silk Smitha.%144 mins.%6.7%Biography-Comedy-Drama%Milan Luthria%Milan Luthria-Vidya Balan-Emraan Hashmi-Tusshar Kapoor
Border%(1997)%In 1971, along the border region of Longewala, a small battalion of Indian soldiers go up against a 2000-(armed) soldier Pakistani strike force.%176 mins.%7.8%Action-War%J.P. Dutta%J.P. Dutta-Rakhee Gulzar-Sunny Deol-Jackie Shroff
Yeh Hai Jalwa%(2002)%Raj Saxena (Salman Khan) goes to London, expecting his long lost Dad (Rishi Kapoor) to warmly greet him. But things do not go as planned.%165 mins.%4.6%Comedy-Drama-Romance%David Dhawan%David Dhawan-Rishi Kapoor-Salman Khan-Ameesha Patel
Shaitan%(2011)%Five substance-abusing friends decide to fake a kidnapping in order to bribe a police constable for covering-up a hit-and-run accident.%121 mins.%7.4%Action-Crime-Drama-Thriller%Bejoy Nambiar%Bejoy Nambiar-Kalki Koechlin-Shiv Pandit-Gulshan Devaiah
Luv Shuv Tey Chicken Khurana%(2012)%Omi Khurana's London dream has just ended. On the run from a dangerous UK gangster who he owes money to...%140 mins.%6.6%Comedy%Sameer Sharma%Sameer Sharma-Kunal Kapoor-Huma Qureshi-Vinod Nagpal
Sapoot%(1996)%Singhania entraps notorious smuggle and gangster named Dhaneshwar with the help of the police, thus giving rise to a saga of anger and revenge...%158 mins.%5.3%Action%Jagdish A. Sharma%Jagdish A. Sharma-Akshay Kumar-Sunil Shetty-Karisma Kapoor
Refugee%(2000)%Bihar-based Manzur Ahmed, his wife, his mother, and his daughter, decide to re-locate to East Pakistan after the partitioning of Hindustan during 1948...%207 mins.%5.6%Drama-Musical-Romance%J.P. Dutta%J.P. Dutta-Jackie Shroff-Sunil Shetty-Abhishek Bachchan
Hello%(2008)%Hello... is a tale about the events that happen one night at a call center. Told through the views of the protagonist...%129 mins.%3.5%Drama-Romance%Atul Agnihotri%Atul Agnihotri-Bharati Achrekar-Amrita Arora-Sharman Joshi
Garam Masala%(2005)%Shyam and Makarand work as photographers in a commercial advertising agency. Both of them like to fool around with women...%146 mins.%6.5%Comedy%Priyadarshan%Priyadarshan-Akshay Kumar-John Abraham-Paresh Rawal
Bandit Queen%(1994)%The movie tells the story of the bandit queen Phoolan Devi who was sent to prison in 1983 and got free in 1994...%119 mins.%7.6%Biography-Crime-Drama%Shekhar Kapur%Shekhar Kapur-Seema Biswas-Nirmal Pandey-Rajesh Vivek
Blue%(2009)%A group of people, facing a lot of challenges, decide to hunt down lost treasure en route to India.%119 mins.%3.7%Action-Adventure-Romance-Thriller%Anthony D'Souza%Anthony D'Souza-Akshay Kumar-Sanjay Dutt-Lara Dutta
Paheli%(2005)%A folk tale - supernatural love story about a ghost who falls in love with a newlywed woman.%140 mins.%6.7%Fantasy-Romance%Amol Palekar%Amol Palekar-Shah Rukh Khan-Anupam Kher-Rani Mukerji
Fugly%(2014)%Four friends fight against a corrupt police officer who extorts money from them for not framing them in a murder which the officer committed himself.%134 mins.%4.8%Drama-Thriller%Kabir Sadanand%Kabir Sadanand-Jimmy Shergill-Mohit Marwah-Kiara Advani
Dil Dosti Etc%(2007)%Delhi-based fellow-collegians-cum-hostelers, Sanjay Mishra, and Apurv, challenge each other to win the...%112 mins.%7.0%Comedy-Crime-Drama%Manish Tiwary%Manish Tiwary-Imaaduddin Shah-Shreyas Talpade-Smriti Mishra
Saagar%(1985)%Raja, a fisherman is secretly in love with Mona. When wealthy Ravi comes to live with his grandmother...%186 mins.%7.3%Drama-Romance%Ramesh Sippy%Ramesh Sippy-Rishi Kapoor-Kamal Haasan-Dimple Kapadia
Hazaaron Khwaishein Aisi%(2003)%Geeta Rao has two admirers - one is Siddharth Tyabji and the other is Vikram Malhotra circa 1969 West...%120 mins.%8.0%Drama%Sudhir Mishra%Sudhir Mishra-Kay Kay Menon-Shiney Ahuja-Chitrangda Singh
Eklavya: The Royal Guard%(2007)%As the kingdom of Devigarh comes apart at the seams, an aging bodyguard attempts to protect the Royal Family, as well as keep its darkest secrets from ever coming to light.%105 mins.%6.2%Action-Drama-Thriller%Vidhu Vinod Chopra%Vidhu Vinod Chopra-Amitabh Bachchan-Saif Ali Khan-Sanjay Dutt
Mohandas%(2009)%Born in a poor family, young Mohandas lands an important job at the 'Oriental Coal Mines'. However,...%112 mins.%7.4%Thriller%Mazhar Kamran%Mazhar Kamran-Sonali Kulkarni-Sharbani Mukherji-Sushant Singh
Anmol%(1993)%Anmol is made to work as a maid in her own house by her step-mother and step-sisters. Later, a singer falls for her and decides to free her from her evil family.%163 mins.%5.8%Drama-Family-Romance%Ketan Desai%Ketan Desai-Anil Dhawan-Puneet Issar-Saeed Jaffrey
Dharam Veer%(1977)%The story revolves around two small kingdoms in British India. Court intrigue, murder, assassination...%165 mins.%6.8%Action-Fantasy%Manmohan Desai%Manmohan Desai-Dharmendra-Zeenat Aman-Jeetendra
Phas Gaye Re Obama%(2010)%A near-bankrupt American is kidnapped by desperate gangsters in India.%108 mins.%7.5%Comedy-Crime%Subhash Kapoor%Subhash Kapoor-Rajat Kapoor-Neha Dhupia-Sanjay Mishra
Kya Dilli Kya Lahore%(2014)%In 1948, a cross-fire erupts at an isolated stretch of Indo-Pak border, leaving only two soldiers alive...%98 mins.%7.5%Drama-History-War%Vijay Raaz%Vijay Raaz-Karan Arora-Vijay Raaz-Manu Rishi Chadha-Rajendranath Zutshi
Satya 2%(2013)%A man who comes to 2013 to reinvent the underworld. Armed with the knowledge which he has acquired through...%142 mins.%5.9%Crime%Ram Gopal Varma%Ram Gopal Varma-Puneet Singh Ratn-Sharvanand-Anaika Soti
Dabangg 2%(2012)%Chulbul Pandey is transferred and promoted to Kanpur. He is happily married with Rajjo. Kanpur witness...%120 mins.%5.0%Action-Comedy-Drama-Musical-Romance%Arbaaz Khan%Arbaaz Khan-Salman Khan-Sonakshi Sinha-Prakash Raj
Money Hai Toh Honey Hai%(2008)%Manikchand Khiralal is a struggling model who gets kicked out by his mentor, Dolly, when she finds another...%138 mins.%2.9%Comedy-Drama%Ganesh Acharya%Ganesh Acharya-Govinda-Manoj Bajpayee-Aftab Shivdasani
Ajab Prem Ki Ghazab Kahani%(2009)%The wacky adventures of a young man who is willing to sacrifice his own love to insure the happiness of others, and get the girl-of-his-dreams married to the boy-of-her-dreams.%150 mins.%6.3%Comedy-Romance%Rajkumar Santoshi%Rajkumar Santoshi-Katrina Kaif-Ranbir Kapoor-Darshan Jariwala
Parinda%(1989)%Two brothers are caught on the different sides of a gang war.%154 mins.%8.0%Action-Crime-Drama-Romance%Vidhu Vinod Chopra%Vidhu Vinod Chopra-Nana Patekar-Vidhu Vinod Chopra-Kamal Chopra
Khal Nayak%(1993)%Ballu (Sanjay Dutt), a notorious, cunning, and unscrupulous criminal who's wanted by the police for a plethora of murders and thefts...%190 mins.%7.3%Action-Adventure-Crime-Drama-Thriller%Subhash Ghai%Subhash Ghai-Rakhee Gulzar-Jackie Shroff-Sanjay Dutt
Himmatwala%(1983)%A poor and wronged woman's son returns from the big city to avenge his father, a honest school teacher.%179 mins.%4.4%Drama-Action-Comedy-Family%K. Raghavendra Rao%K. Raghavendra Rao-Shoma Anand-Asrani-Arun Govil
Disco Dancer%(1982)%Jimmy promises to return to Bombay and become a famous entertainer so that he can exact revenge on Mr...%135 mins.%6.3%Romance-Musical-Action-Drama%Babbar Subhash%Babbar Subhash-Mithun Chakraborty-Kim-Kalpana Iyer
Koyla%(1997)%Mute Shankar slogs day and night to satisfy the lust of wealthy businessman Raja Saab who has underworld contact...%166 mins.%6.2%Action-Drama-Musical-Romance-Thriller%Rakesh Roshan%Rakesh Roshan-Shah Rukh Khan-Madhuri Dixit-Amrish Puri
Nishabd%(2007)%A man, who has been married for 27 years, falls in love with his 18-year-old daughter's friend.%110 mins.%5.4%Drama%Ram Gopal Varma%Ram Gopal Varma-Amitabh Bachchan-Jiah Khan-Revathy
Kaal%(2005)%A tiger expert, his wife, two tourists and a village chief engage in a battle for survival against supernatural beasts within Jim Corbett National Wildlife Park.%126 mins.%4.3%Thriller-Adventure-Mystery%Soham Shah%Soham Shah-Ajay Devgn-Vivek Oberoi-John Abraham
Kaanchi%(2014)%The inner power of a woman who represents over one million suppressed youth against injustice in the country.%151 mins.%4.3%Drama-Musical-Romance%Subhash Ghai%Subhash Ghai-Kartik Tiwari-Mishti-Rishi Kapoor
Teesri Manzil%(1966)%A woman blames a nightclub drummer for the suspicious death of her sister, and seeks revenge. However, the pair work together to solve the mystery and become romantically involved, after he introduces himself under another name.%172 mins.%7.8%Comedy-Musical-Mystery-Romance-Thriller%Vijay Anand%Vijay Anand-Shammi Kapoor-Asha Parekh-Raj Mehra
Trimurti%(1995)%Entrapped by notorious gangster, Khokha Singh; an honest police inspector Satyadevi Singh gets a life sentence in jail...%187 mins.%4.6%Action-Romance%Mukul Anand%Mukul Anand-Mohan Agashe-Tinnu Anand-Gautami
Amar Akbar Anthony%(1977)%Three brothers are separated and united after many years - one is brought up a Hindu, another a Muslim and the last (and most memorable) a Christian. Hilarity and adventure ensues.%184 mins.%7.6%Action-Comedy-Drama-Family%Manmohan Desai%Manmohan Desai-Vinod Khanna-Rishi Kapoor-Amitabh Bachchan
Chameli%(2003)%On a rainy night, when an investment banker's car breaks down in the red light district, he takes shelter where he meets and later befriends a prostitute.%108 mins.%7.2%Drama%Sudhir Mishra%Sudhir Mishra-Kareena Kapoor-Rahul Bose-Rinke Khanna
Ghulam-E-Musthafa%(1997)%At the behest of Mahesh Verma, Shanta Prasad alias Abba, recruits Ghulam-E-Musthafa, a gangster and hit-man to carry out their nefarious activities...%162 mins.%6.6%Action-Crime-Drama%Partho Ghosh%Partho Ghosh-Nana Patekar-Raveena Tandon-Paresh Rawal
Dhanak%(2015)%Rainbow is an uplifting, enchanting, magical fable set in Rajasthan that reinforces the belief that life is beautiful...%106 mins.%6.8%Drama%Nagesh Kukunoor%Nagesh Kukunoor-Swastik Ram Chavan-Krrish Chhabria-Vibha Chhibber
No One Killed Jessica%(2011)%A journalist, who is more of an activist teams up with the sister of a murdered model, as she gets interested in the case and wants to bring justice to her case.%136 mins.%7.2%Crime-Drama-Thriller%Raj Kumar Gupta%Raj Kumar Gupta-Rani Mukerji-Vidya Balan-Myra Karn
No Smoking%(2007)%A man fights against a tyrannical institution for his right to smoke, hence, for individual freedom.%128 mins.%7.1%Drama-Fantasy-Mystery-Thriller%Anurag Kashyap%Anurag Kashyap-John Abraham-Ayesha Takia-Paresh Rawal
Ek Ajnabee%(2005)%Movie is a remake of the Hollywood movie Man on Fire (2004). Quite an effort to reproduce the movie with quite a different climax.%142 mins.%5.2%Action-Adventure-Crime-Drama-Thriller%Apoorva Lakhia%Apoorva Lakhia-Amitabh Bachchan-Arjun Rampal-Perizaad Zorabian
Zakhm%(1998)%Amidst religious riots, a son deals with his mother's life-threatening injuries, and her last request.%125 mins.%8.0%Action-Drama%Mahesh Bhatt%Mahesh Bhatt-Ajay Devgn-Pooja Bhatt-Sonali Bendre
Vivah%(2006)%Poonam, a traditionally brought-up young woman, is to marry Prem, a groom chosen by her uncle. Poonam and Prem's faith and love are to be tested however, when an accident occurs and Poonam might be scarred for life.%160 mins.%6.8%Drama-Family-Musical-Romance%Sooraj R. Barjatya%Sooraj R. Barjatya-Shahid Kapoor-Amrita Rao-Anupam Kher
Masti%(2004)%Three friends meet after their marriages who are all disturbed by their wifes decided to take a break and look for the other girl but they put themselves in trouble and accused for the murder of a girl.%166 mins.%6.1%Comedy-Crime-Mystery-Romance-Thriller%Indra Kumar%Indra Kumar-Aftab Shivdasani-Vivek Oberoi-Riteish Deshmukh
Mehboob Ki Mehndi%(1971)%Yusuf lives a wealthy lifestyle with his businessman dad, Safdarjang, who is confined to a wheel-chair...%151 mins.%7.3%Musical-Romance%Harnam Singh Rawail%Harnam Singh Rawail-Rajesh Khanna-Leena Chandavarkar-Pradeep Kumar
Taxi No. 9 2 11: Nau Do Gyarah%(2006)%A cabbie (Patekar) and businessman (Abraham) both in need of big money partake in a two-hour adventure together.%116 mins.%7.3%Comedy-Drama-Thriller%Milan Luthria%Milan Luthria-John Abraham-Nana Patekar-Sonali Kulkarni
Dangerous Ishq%(2012)%Three doppelgangers(one girl+ two boys).Two of them loves each other and get together from many lives .And the third one(who can't be killed easily)also wants the girl and he tries to separate them through many lives.%130 mins.%3.9%Romance-Thriller%Vikram Bhatt%Vikram Bhatt-Karisma Kapoor-Jimmy Shergill-Gracy Singh
Satyam Shivam Sundaram: Love Sublime%(1978)%Rupa (Zeenat Aman) grew up being cursed as "unlucky" in the village she was born in. Her mother died during childbirth...%172 mins.%7.2%Drama-Romance%Raj Kapoor%Raj Kapoor-Shashi Kapoor-Zeenat Aman-Kanhaiyalal Chaturvedi
Jism%(2003)%Kabir Lal is an alcoholic lawyer whose life is looking as if going down the drain. One morning he sees...%136 mins.%5.2%Drama-Romance-Thriller%Amit Saxena%Amit Saxena-Bipasha Basu-John Abraham-Gulshan Grover
Cheeni Kum%(2007)%An egotistical 64-year-old chef and confirmed bachelor falls for a woman 30 years his junior.%140 mins.%6.8%Comedy-Romance%R. Balki%R. Balki-Amitabh Bachchan-Tabu-Paresh Rawal
Thoda Pyaar Thoda Magic%(2008)%God sends a rambunctious angel to help a businessman and the four orphans, whose parents he killed, become a family.%145 mins.%4.9%Comedy-Drama-Family-Fantasy-Romance%Kunal Kohli%Kunal Kohli-Rishi Kapoor-Saif Ali Khan-Rani Mukerji
Dasvidaniya%(2008)%A man who loves to make "to-do lists" makes one last bucket list when he realizes he is about to die.%113 mins.%7.9%Comedy-Drama%Shashant Shah%Shashant Shah-Vinay Pathak-Sarita Joshi-Rajat Kapoor
Vaastav: The Reality%(1999)%Raghunath Namdev Shivalkar (Sanjay Dutt) and his best friend Dedh Footiya (Sanjay Narvekar) struggle to find work in Mumbai...%145 mins.%8.0%Action-Adventure-Crime-Drama-Thriller%Mahesh Manjrekar%Mahesh Manjrekar-Sanjay Dutt-Namrata Shirodkar-Mohnish Bahl
Thank You%(2011)%Three wives engage the services of a private investigator after they suspect their respective husbands of infidelity.%125 mins.%4.5%Comedy-Drama-Romance%Anees Bazmee%Anees Bazmee-Akshay Kumar-Sonam Kapoor-Bobby Deol
Badlapur Boys%(2014)%A story about a bunch of underdogs who not only play Kabaddi passionately, but also get involved in crucial socio-economic issues.%123 mins.%5.1%Drama%Shailesh Verma%Shailesh Verma-Annu Kapoor-Anupam Maanav-Saranya Mohan
You Must Be Scared%(2006)%Pahwa is a film buff. He watches every new release in the night show on the first day itself. Just as...%108 mins.%5.3%Comedy-Horror-Thriller%J.D. Chakravarthi%J.D. Chakravarthi-Manish Gupta-Amitabh Bachchan-Arjun Rampal-Anil Kapoor
Shalimar%(1978)%On the run from the police, S.S. Kumar, a thief, comes across a private invitation to the island of Sir John Locksley addressed to Raja Bahadur Singh...%137 mins.%6.3%Action-Adventure-Crime%Krishna Shah%Krishna Shah-Dharmendra-Zeenat Aman-Rex Harrison
Chal Bhaag%(2014)%Chal Bhaag kickstarts with an MLA being murdered by three shooters. The incident coincides with the arresting of Munna, Bunty and Daler for their small time crimes.%111 mins.%4.1%Comedy%Prakash Saini%Prakash Saini-Deepak Dobriyal-Keeya Khanna-Sanjay Mishra
Gippi%(2013)%Gippi is a 14-year-old girl who lives in Simla with her mother Pappi and little brother Booboo. She...%95 mins.%5.6%Comedy-Drama%Sonam Nair%Sonam Nair-Mrinal Chawla-Divya Dutta-Arbaz Kadwani
Shaadi Ke Side Effects%(2014)%A complicated relationship develops between a man and woman after getting married and having a baby.%145 mins.%5.7%Comedy-Romance%Saket Chaudhary%Saket Chaudhary-Farhan Akhtar-Vidya Balan-Vir Das
Alibaba Aur 40 Chor%(1979)%Alibaba, (Dharmendra) a native of Guleba is in love with Marjina (Hema Malini). The town has a ruler...%138 mins.%6.2%Action-Adventure-Family-Romance%Latif Faiziyev%Latif Faiziyev-Umesh Mehra-Dharmendra-Hema Malini-Zeenat Aman
Life in a Metro%(2007)%Six different stories, about nine people, each with different issues and problems, all occurring within one place: the METRO.%132 mins.%7.4%Comedy-Drama-Romance%Anurag Basu%Anurag Basu-Dharmendra-Irrfan Khan-Konkona Sen Sharma
Mere Dad Ki Maruti%(2013)%Everyone's dancing and making merry in the Khullar household, especially Tej who is all set to gift...%101 mins.%6.5%Comedy%Ashima Chibber%Ashima Chibber-Saqib Saleem-Rhea Chakraborty-Ram Kapoor
Aashayein%(2010)%A man meets with assorted characters in a nursing home after being diagnosed with cancer.%120 mins.%7.1%Comedy-Drama%Nagesh Kukunoor%Nagesh Kukunoor-John Abraham-Anaitha Nair-Girish Karnad
Bandh Darwaza%(1990)%A wealthy male banishes a demon, but years later his very own daughter resurrects it.%155 mins.%5.1%Action-Drama-Horror-Thriller%Shyam Ramsay%Shyam Ramsay-Tulsi Ramsay-Hashmat Khan-Manjeet Kullar-Kunika
